{
  "memo_id": "odg-BOOTSTRAP-01-0001",
  "created_at": "2026-08-06T15:45:42.658770Z",
  "task_id": "BOOTSTRAP-01",
  "project_id": "P-MICP-ROAD-01",
  "title": "MICP 道路加固现场部署",
  "current_state": "PILOT_READY",
  "proposed_state": "DEPLOYABLE",
  "decision": "PASS",
  "decision_summary": "决策 PASS: PILOT_READY → DEPLOYABLE",
  "gate_results": {
    "state_gate": {
      "current_state": "PILOT_READY",
      "proposed_state": "DEPLOYABLE",
      "legal": true,
      "grade_gap": 1,
      "notes": [
        "blocking rules evaluated: 0",
        "dimension floors: passed",
        "mission: 2 met / 0 not met"
      ]
    },
    "blockers": [],
    "dimensions": {
      "scores": {
        "SCIENTIFIC_VALIDITY": 0.8357142857142856,
        "EVIDENCE_QUALITY": 0.8142857142857143,
        "REPRODUCIBILITY": 0.8,
        "ENGINEERING_FEASIBILITY": 0.9666666666666667,
        "SCALE_READINESS": 1.0,
        "ENVIRONMENTAL_ACCEPTABILITY": 0.9,
        "BIOSAFETY": 0.95,
        "REGULATORY_STATUS": 0.8666666666666667,
        "ECONOMIC_VIABILITY": 0.85,
        "MONITORABILITY": 0.9,
        "REVERSIBILITY": 0.75,
        "RESIDUAL_RISK": 1.0
      },
      "floors": {
        "SCIENTIFIC_VALIDITY": 0.8,
        "EVIDENCE_QUALITY": 0.8,
        "REPRODUCIBILITY": 0.75,
        "ENGINEERING_FEASIBILITY": 0.75,
        "SCALE_READINESS": 0.75,
        "ENVIRONMENTAL_ACCEPTABILITY": 0.8,
        "BIOSAFETY": 0.8,
        "REGULATORY_STATUS": 0.8,
        "ECONOMIC_VIABILITY": 0.7,
        "MONITORABILITY": 0.8,
        "REVERSIBILITY": 0.7,
        "RESIDUAL_RISK": 0.75
      },
      "passed": true,
      "below_floor": []
    },
    "mission": {
      "criteria_met": [
        "强度≥5MPa",
        "氨排放≤500 mg/m3"
      ],
      "criteria_not_met": [],
      "failure_thresholds_triggered": [],
      "metrics": [
        {
          "name": "strength",
          "direction": "maximize",
          "current_value": 5.4,
          "target_value": null,
          "threshold_value": 5.0,
          "status": "met",
          "note": ""
        },
        {
          "name": "ammonia_emission",
          "direction": "minimize",
          "current_value": 480.0,
          "target_value": null,
          "threshold_value": 500.0,
          "status": "met",
          "note": ""
        }
      ]
    }
  },
  "blocking_items": [],
  "criteria_met": [
    "强度≥5MPa",
    "氨排放≤500 mg/m3"
  ],
  "criteria_not_met": [],
  "supporting_evidence": [
    {
      "ref_id": "REF-C1",
      "label": "REPORTED",
      "statement": "砂柱 UCS 提升 3-8 MPa",
      "source": "doi:10.1016/j.conbuildmat.2024.12345"
    },
    {
      "ref_id": "REF-C2",
      "label": "REPORTED",
      "statement": "灌浆 5 循环后强度稳定",
      "source": "doi:10.1016/j.enggeo.2024.67890"
    },
    {
      "ref_id": "REF-C3",
      "label": "REPORTED",
      "statement": "中试路段强度 5.4 MPa，氨峰值 480 mg/m3",
      "source": "doi:10.1016/j.jclepro.2024.11223"
    }
  ],
  "opposing_evidence": [
    {
      "ref_id": "REF-C1",
      "label": "REPORTED",
      "statement": "砂柱 UCS 提升 3-8 MPa",
      "source": "doi:10.1016/j.conbuildmat.2024.12345"
    },
    {
      "ref_id": "REF-C2",
      "label": "REPORTED",
      "statement": "灌浆 5 循环后强度稳定",
      "source": "doi:10.1016/j.enggeo.2024.67890"
    },
    {
      "ref_id": "REF-C3",
      "label": "REPORTED",
      "statement": "中试路段强度 5.4 MPa，氨峰值 480 mg/m3",
      "source": "doi:10.1016/j.jclepro.2024.11223"
    }
  ],
  "residual_uncertainty": [
    {
      "statement": "见维度评分与阻断项",
      "impact": "medium"
    }
  ],
  "risk_benefit": {
    "net_positive": true,
    "benefit": "mean positive-dimension benefit 0.89",
    "risk": "residual risk 0.00 (inverse of RESIDUAL_RISK)",
    "residual_risk_score": 0.0,
    "benefit_score": 0.888,
    "assessment": "benefit clearly outweighs residual risk"
  },
  "required_human_approvals": [
    {
      "scope": "DEPLOYABLE",
      "reason": "进入 DEPLOYABLE 需要人类批准 (grade 6 >= 4)",
      "status": "granted",
      "revision": 42
    }
  ],
  "conditional_release_terms": [],
  "monitoring_requirements": [
    {
      "parameter": "氨浓度(在线+便携)",
      "frequency": "per scale-up plan",
      "alert_condition": "threshold breach"
    },
    {
      "parameter": "地下水pH与氨",
      "frequency": "per scale-up plan",
      "alert_condition": "threshold breach"
    },
    {
      "parameter": "强度抽芯",
      "frequency": "per scale-up plan",
      "alert_condition": "threshold breach"
    },
    {
      "parameter": "沉降观测",
      "frequency": "per scale-up plan",
      "alert_condition": "threshold breach"
    },
    {
      "parameter": "shutdown",
      "frequency": "continuous",
      "alert_condition": "氨浓度>500 mg/m3 持续 30min"
    },
    {
      "parameter": "shutdown",
      "frequency": "continuous",
      "alert_condition": "地下水氨>10 mg/L"
    },
    {
      "parameter": "shutdown",
      "frequency": "continuous",
      "alert_condition": "pH 超出 6-9"
    },
    {
      "parameter": "shutdown",
      "frequency": "continuous",
      "alert_condition": "沉降>10mm"
    }
  ],
  "failure_conditions": [
    {
      "condition": "氨浓度>500 mg/m3 持续 30min",
      "action": "停工并执行回退方案"
    },
    {
      "condition": "地下水氨>10 mg/L",
      "action": "停工并执行回退方案"
    },
    {
      "condition": "pH 超出 6-9",
      "action": "停工并执行回退方案"
    },
    {
      "condition": "沉降>10mm",
      "action": "停工并执行回退方案"
    }
  ],
  "next_actions": [
    {
      "action": "补充任务相关证据",
      "reason": "证据不足以升级",
      "priority": "medium",
      "skill": "micp-literature-scout"
    }
  ],
  "review_expiry": "2027-02-01T00:00:00Z",
  "reviewer": "obsidian-decision-gate",
  "approved_by": "工程总监（人类）",
  "provenance": {
    "skill": "obsidian-decision-gate",
    "generated_by": "obsidian-decision-gate",
    "contract_version": "1.0"
  }
}